name,alpha_acid,origin,beta_acid,notes,substitutes,total_oil,myrcene,humulene,cohumulone,caryophyllene,farnesene
Canterbury Whitebine,0.0,UK,0.0,Delicate flavor,"East Kent Golding, Mathon",0.0,0.0,0.0,0.0,0.0,0.0
Equinox,15,US,5,"Notes of lemon and lime citrus, fruits like papaya and apple, green peppers and herbs",,3.5,0.0,0.0,35,0.0,0.0
Neoplanta,9.7,Slovenia,3.95,,,0.65,49,20,36,8.9,5
Polaris,20.5,Germany,5.25,"Banana, Woodruff, Bergamot, Pineapple, Mint",,4.5,0.0,27.5,25,10.5,1
Sussex,5.05,UK,2.8,Delicate tropical flavors and a unique fruit-forward aroma,"Progress, Whitbread Golding, Fuggle",0.5,42,23,30.5,0.0,1
Saxon,9,UK,4.5,Pleasant aroma,,0.475,54,11.8,20,5.6,6.7
Alliance,6.05,UK,3.3499999999999996,,,0.91,36.7,33,29,11.3,1.9
Herald,12.350000000000001,UK,5.15,,Pioneer,1.45,40,15,36,7,0.5
Eastwell Golding,6,UK,3,,,0.75,50,25,30,8,0.2
Mathon,5.550000000000001,UK,2.3499999999999996,Goldings-style aroma,"Bramling, East Kent Golding, Progress, Whitbread Golding",0.9,0.0,0.0,29,0.0,0.0
Buket,11,Slovenia,4.9,,,1.075,57,17,24,5.4,5.5
Chinook,13,Unknown,3.5,"Red Berries, Fennel, Basil, Elderberry, Lychee","Galena, Eroica, Nugget, Bullion, Columbus, Northern Brewer, Target",2.1,37.5,21.5,31.5,10,0.5
Hüller Bitterer,5.75,Germany,5,,,1.25,39.5,15,28.5,6.5,0.5
Styrian Wolf,14.25,Slovenia,5.5,,,2.9000000000000004,65,7,22.5,2.5,5.5
Blato,4.5,Czech Republic,3.5,Similar delicate aroma profile to other Saaz hops,,0.325,47,18,21,5,11.2
Bramling,5.8,UK,3,Pleasant European aroma,"Whitbread Golding, Progress, East Kent Golding",0.45,0.0,0.0,27,0.0,0.0
Cascade (Australia),6,Australia,6,Same as Cascade (US) but with notes of grapefruit,"Hallertau, East Kent Golding",1.05,50,50,36.5,6,7
Mount Hood,6,US,6.5,Noble hop aroma,"Crystal, Strisselspalter, Hersbrucker",1.35,35,25,22,11.5,0.5
Fantasia®,4.3,Unknown,0.0,"Fruit, noble aromas, cream, caramel",,0.45,0.0,0.0,0.0,0.0,0.0
Super Galena,14.5,United States,9,"Plum, Juniper, Honey, Strawberries",,31.25,45,0.0,0.0,0.0,0.0
Tsingdao Flower,7,China,3.6,"Grapefruit, Cream, Cassis, Tabacco",,27.9,45,0.0,0.0,0.0,0.0
Amarillo® VGXP01 c.v.,9.5,United States,6.5,"Black tea with lemon, Melon, Apricot, Grapefruit",,35.95,68,0.0,0.0,0.0,0.0
Topaz™,16.75,Australia,6.5,"Blackberry, Grapefruit, Blueberry, Passion fruit, Spicy",,22.6,25,0.0,0.0,0.0,0.0
Northern Brewer,9,United States,4,,,1.75,0.0,0.0,0.0,0.0,0.0
Hallertauer Magnum,13.5,Germany,6,"Apple, Lemon, Mint, Chocolate, Green peppers",,23.8,30,0.0,0.0,0.0,0.0
Enigma™,15,Australia,5.6,"Nutmeg, Passion fruit, Red currant, Camomile, Rose hip",,19,20,0.0,0.0,0.0,0.0
Mosaic®,12.5,United States,3.55,"Gooseberry, Pear, Mandarin, Lime, Peach",,31.25,47,0.0,0.0,0.0,0.0
Extra Styrian Dana,15.65,Slovenia,5.1,"Juniper, Orange, Wild garlic, Pear",,31.95,42,0.0,0.0,0.0,0.0
Summit®,17,United States,5,"Wild garlic, Aniseed, Gooseberry, Incense, Pepper",,26.25,35,0.0,0.0,0.0,0.0
Fuggles,4.3,Great Britain,2.5,"Curry, Celeriac, Green tea, Hay",,14.7,24,0.0,0.0,0.0,0.0
Diamant,0.0,Germany,0.0,"Fennel, Lavender, Citrus",,0.0,0.0,0.0,0.0,0.0,0.0
Hersbrucker Spät,2.75,Germany,4.25,"Citrus, Black tea, Melissa, Marjoram",,15.5,15,0.0,0.0,0.0,0.0
Talus™,8.8,United States,9.25,"Pink Grapefruit, Pine, Resin, Dried Roses",,25,40,0.0,0.0,0.0,0.0
Ella™,14.8,Australia,7,"Citrus, Lavender, Bergamot oil, Sage, Melissa",,23.2,33,0.0,0.0,0.0,0.0
Lublin,3.75,Poland,3.5,"Lemon tea, Curry, Dill, Juniper, Floral",,15.05,22,0.0,0.0,0.0,0.0
Azacca™,15,United States,4.75,"Gooseberry, Celeriac, Grapefruit, Pineapple, Peach",,28.5,46,0.0,0.0,0.0,0.0
Saazer,4.5,Czech Republic,6.25,"Bergamot, Honey, Woody, Camomile tea, Spicy",,20.5,25,0.0,0.0,0.0,0.0
Loral®,11,United States,5,,,20.75,37,0.0,0.0,0.0,0.0
Wye Challenger,7.5,Great Britain,3.4,"Banana, Gingerbread, Cognac",,16.75,28,0.0,0.0,0.0,0.0
Kazbek,6.5,Czech Republic,5,"Raspberry, Peach, Orange, Passion fruit, Chocolate",,28.4,40,0.0,0.0,0.0,0.0
Relax,0.9,Germany,12.5,"Cognac, Lychee, Rose hip, Lavender, Leather",,15.65,17,0.0,0.0,0.0,0.0
Hallertauer Mittelfrüher,4.25,Germany,4,"Aniseed, Blackberry, Liquorice, Citrus fruits, Bergamot",,14.65,20,0.0,0.0,0.0,0.0
Endeavour,9.05,Great Britain,4.55,"Blackberry, Bergamot, Gingerbread, Lemon, Watermelon",,19.4,27,0.0,0.0,0.0,0.0
Mt. Hood,5.5,United States,6.5,"Honey, Tarragon, Lemon tea, Lemon cake, Fennel",,20.85,30,0.0,0.0,0.0,0.0
Pahto,18.5,United States,5.25,"Earth, Pepper, Plum, Resin",,26,48,0.0,0.0,0.0,0.0
Galaxy,13.5,Australia,5.75,"Peach, Blackberries, Blueberries, Cassis, Aniseed",,25.85,33,0.0,0.0,0.0,0.0
Whitbread Golding Variety (WGV),6.550000000000001,Great Britain,2.65,"Fig, Banana, Liquorice, Apricot",,14.1,24,0.0,0.0,0.0,0.0
National,5.5,Ukraine,0.0,"Chocolate, Bergamot, Straw, Gerbera, Wild garlic",,0.0,0.0,0.0,0.0,0.0,0.0
Harmonie,6.5,Czech Republic,6.5,"Banana, Creamy, Green tea, Apricot, Caramel",,20.7,30,0.0,0.0,0.0,0.0
Sybilla,7.25,Poland,4,"Chocolate, Orange, Gingerbread, Barrique, Tobacco",,26.05,30,0.0,0.0,0.0,0.0
Magnat,13.5,Poland,5,"Citrus, Woody, Camomile blossom, Kitchenherbs, Lemon cake",,30.5,30,0.0,0.0,0.0,0.0
Cluster,7,United States,5,"Strawberry, Lemon tea, Apricot, Creamy, Grapefruit",,27.9,45,0.0,0.0,0.0,0.0
Tettnang Tettnanger,4,Germany,4,"Floral, Bergamot, Lily of the Valley, Cognac, Chocolate",,17.95,20,0.0,0.0,0.0,0.0
Spalt Spalter,4,Germany,4,"Tea, Barrique, Ripe banana, Tonka beans, Woodruff",,17.95,20,0.0,0.0,0.0,0.0
Callista,3.5,Germany,7.5,"Strawberry, Pear, Caramel, Passion fruit, Orange",,32.8,54,0.0,0.0,0.0,0.0
Ariana,11.5,Germany,5.25,"Passion fruit, Pineapple, Quince, Jasmine, Tangerine",,30,47,0.0,0.0,0.0,0.0
Styrian Savinjski Golding,5.25,Slovenia,3,"Lemon tea, Peppermint, Lemon grass",,17,27,0.0,0.0,0.0,0.0
Wye Target,11,Great Britain,5,"Tobacco, Elderberry, Caramel, Vanilla, Cognac",,28.2,45,0.0,0.0,0.0,0.0
Monroe,2.8499999999999996,Germany,7,"Strawberry, Passion fruit, Cherry, Red currant, Plum",,0.0,0.0,0.0,0.0,0.0,0.0
Saaz Late,4.75,Czech Republic,5.25,"Passion fruit, Lemon, Raspberry, Blackberry, Camomile tea",,18,25,0.0,0.0,0.0,0.0
Huell Melon,7.5,Germany,7,"Wild strawberry, Geranium, Peach iced tea, Aniseed",,22.05,26,0.0,0.0,0.0,0.0
Brewers Gold,5.5,Great Britain,3,"Lemon, Redcurrant, Melissa, Spices",,25.9,40,0.0,0.0,0.0,0.0
Cascade,5.75,United States,5.9,"Strawberry, Citrus, Blackberry, Lychee, Toffee",,30.7,45,0.0,0.0,0.0,0.0
Triple Pearl,10.75,United States,3.75,,,28.4,39,0.0,0.0,0.0,0.0
Palisade,7.5,United States,7,"Apricot, Orange, Passion fruit, Honey, Yoghurt",,5.8,9,0.0,0.0,0.0,0.0
Marco Polo,12.5,China,5,"Lemon, Lemon blam, Gooseberry, Oregano, Elderflower",,25,40,0.0,0.0,0.0,0.0
Ekuanot®,15,United States,5,"Guava, Fennel, Strawberry, Grapefruit, Gooseberry",,24.75,30,0.0,0.0,0.0,0.0
